{
    "$schema": "http://json-schema.org/draft-07/schema",
    "title": "TASS Execution File",
    "description": "A TASS job file, to be executed using the TASS framework.",
    "type": "object",
    "properties": {
        "schema-version": {
            "type": "string",
            "pattern": "^1\\.2(\\.(\\*|\\d+))?$"
        },
        "Job": {
            "description": "Description of the job. Sets default values for undefined test case values.",
            "type": "object",
            "properties": {
                "title": {
                    "description": "Name of the job. Defaults to the file name.",
                    "type": "string"
                },
                "uuid": {"$ref": "#/$defs/uuid"},
                "build": {
                    "description": "Build of the application being tested. Inherited by test cases if not specified.",
                    "type": "string"
                },
                "parent": {
                    "description": "Description of the parent job if generated from converter.",
                    "type": ["object", "string"],
                    "properties": {
                        "uuid": {"$ref": "#/$defs/uuid"},
                        "title": {
                            "description": "Title of the parent document.",
                            "type": "string"
                        },
                        "path": {
                            "description": "File path of the parent document at the time of conversion.",
                            "type": "string"
                        }
                    }
                },
                "hooks":{
                    "$ref": "#/$defs/uuid-list"
                }
            }
        },
        "Tests": {
            "description": "List of Test cases with configurations that may be executed.",
            "type": "array",
            "items": {"$ref": "#/$defs/test"}
        },
        "Cases": {
            "description": "List of Test cases that may be executed.",
            "type": "array",
            "items": {"$ref": "#/$defs/case"}
        },
        "Steps": {
            "description": "List of steps, singular actions, that can be executed in a test case.",
            "type": "array",
            "items": {"$ref": "#/$defs/step"}
        },
        "Browsers": {
            "description": "Browser configurations to be used in this test run.",
            "type": "array",
            "items": {"$ref": "#/$defs/browser"}
        },
        "Mobiles": {
            "description": "Mobile configurations to be used in this test run.",
            "type": "array",
            "items": {"$ref": "#/$defs/mobile"}
        },
        "Hooks": {
            "description": "Hook configurations for this test run.",
            "type": "array",
            "items": {"$ref": "#/$defs/hook"}
        },
        "Meta": {
            "description": "Additional information about this test run that does not affect the test.",
            "type": "object",
            "properties": {
                "results-path": {
                    "type": "string",
                    "description": "File path to write results. Overwrites default."
                },
                "pages-path": {
                    "type": "string",
                    "description": "File path to read POM files from."
                }
            }
        }
    },
    "$defs": {
        "uuid": {
            "type": "string",
            "description": "Universally Unique Identifier",
            "$comment": "Created as a definition for possible future functionality. Validating uuids."
        },
        "uuid-list": {
            "type": "array",
            "items": {
                "$ref": "#/$defs/uuid"
            },
            "description": "List of uuids"
        },
        "test": {
            "type": "object",
            "description": "Test to be executed. Includes which case and any other configuration settings.",
            "properties": {
                "uuid": {
                    "$ref": "#/$defs/uuid",
                    "description": "The uuid of this test. Typically a compounded uuid of the job, case, and configuration uuids."
                },
                "case": {
                    "$ref": "#/$defs/uuid",
                    "description": "The uuid of the case that will be executed."
                },
                "configuration": {
                    "type": "object",
                    "description": "Contains the various configurations for running a case.",
                    "properties": {
                        "browser": {
                            "$ref": "#/$defs/uuid",
                            "description": "The uuid of the browser used in this configuration."
                        },
                        "hooks": {
                            "$ref": "#/$defs/uuid-list"
                        }
                    }
                }
            }
        },
        "case": {
            "type": "object",
            "description": "Describes a singular test case. Test cases should be independant of one another.",
            "properties": {
                "uuid": {"$ref": "#/$defs/uuid"},
                "title": {
                    "type": "string",
                    "description": "Human readable descriptor for the test case."
                },
                "build": {
                    "type": "string",
                    "description": "Version of the application being tested."
                },
                "steps": {"$ref": "#/$defs/uuid-list"}
            },
            "required": ["uuid", "title", "steps"]
        },
        "step": {
            "type": "object",
            "description": "Describes a singular step, a single action to be takenby the automation.",
            "properties": {
                "uuid": {"$ref": "#/$defs/uuid"},
                "title": {
                    "type": "string",
                    "description": "Human readable descriptor for the step."
                },
                "action": {
                    "$comment": "TODO: Create external step schema to further validate steps for each action/parameters.",
                    "type": "array",
                    "minItems": 2,
                    "maxItems": 2,
                    "items":{
                        "type": "string"
                    },
                    "description": "An array with a length of 2, the first string states the module, the second the action."
                },
                "parameters": {
                    "type": "object",
                    "description": "Parameters content is dependant on the action used."
                }
            },
            "required": ["uuid", "title", "action", "parameters"]
        },
        "browser": {
            "type": "object",
            "description": "Configuration for a browser.",
            "properties": {
                "uuid": {"$ref": "#/$defs/uuid"},
                "browser_name": {
                    "enum": ["chrome", "firefox", "edge", "safari"],
                    "description": "The name of the browser to be used."
                },
                "configs": {
                    "type": "object",
                    "properties": {
                        "driver": {
                            "type": "object",
                            "description": "Configuration values for the automated driver."
                        },
                        "browser": {
                            "type": "object",
                            "description": "Configurations for browser preferences.",
                            "properties": {
                                "arguments": {
                                    "type": "array",
                                    "items": { "type": "string" },
                                    "description": "Flags to be passed to the browser instance"
                                },
                                "preferences": {
                                    "type": "object",
                                    "description": "Key value pairs to set preferences of a browser."
                                }
                            }
                        }
                    }
                }
            },
            "oneOf": [
                {"required": ["uuid", "browser_name", "configs"]},
                {"required": ["uuid", "driver_name", "configs"]}
            ]
        },
        "mobile": {
            "type": "object",
            "description": "Configuration for a mobile.",
            "properties": {
                "uuid": {"$ref": "#/$defs/uuid"},
                "driver_name": {
                    "enum": ["android", "ios"],
                    "description": "The name of the mobile platform to be used."
                },
                "configs": {
                    "type": "object",
                    "properties": {
                        "driver": {
                            "type": "object",
                            "description": "Configuration values for the automated driver."
                        },
                        "browser": {
                            "type": "object",
                            "description": "Configurations for browser preferences.",
                            "properties": {
                                "arguments": {
                                    "type": "array",
                                    "items": { "type": "string" },
                                    "description": "Flags to be passed to the browser instance"
                                },
                                "preferences": {
                                    "type": "object",
                                    "description": "Key value pairs to set preferences of a browser."
                                }
                            }
                        },
                        "appium:server": {
                            "type": "object",
                            "description": "Configurations for appium server/driver"
                        },
                        "appium:driver": {
                            "type": "object",
                            "description": "Capabilities for the appium driver."
                        }

                    },
                    "required": ["appium:driver", "appium:server"]
                }
            },
            "required": ["uuid", "driver_name", "configs"]
        },
        "hook":{
            "type": "object",
            "description": "A hook configuration",
            "properties": {
                "when": {
                    "type": "string",
                    "description": "String representation of the hook triggering event.",
                    "enum": ["before_run", "before_test", "on_start", "on_failure", "on_success", "on_finish", "after_test", "after_run"]
                },
                "hook": {
                    "type": "string",
                    "description": "The name of the hook."
                },
                "namespace": {
                    "type": "string",
                    "description": "The namespace the hook belongs to. EX: 'core', 'selenium'"
                },
                "critical": {
                    "type": "boolean",
                    "description": "Overwrites default hook failure severity."
                },
                "order": {
                    "type": "integer",
                    "description": "Number to define order of execution. Smaller values are executed first."
                },
                "args": {
                    "type": "object",
                    "description": "JSON object representing keyword arguments passed to the hook prior to execution."
                }
            },
            "required": ["when", "hook", "namespace"]
        }
    }
}